show_id,type,title,director,country,date_added,release_year,rating,duration,listed_in,duracao_min
s4626,Movie,Two Catalonias,"Álvaro Longoria, Gerardo Olivares",Spain,9/28/2018,2018,TV-MA,117 min,"Documentaries, International Movies",117
s4627,Movie,In Darkness,Anthony Byrne,United Kingdom,9/22/2018,2018,TV-MA,101 min,"Independent Movies, International Movies, Thrillers",101
s4631,Movie,Quincy,"Rashida Jones, Alan Hicks",United States,9/21/2018,2018,TV-MA,124 min,"Documentaries, Music & Musicals",124
s4642,Movie,The Angel,Ariel Vromen,Israel,9/14/2018,2018,TV-MA,114 min,"Dramas, International Movies, Thrillers",114
s4643,Movie,The Land of Steady Habits,Nicole Holofcener,United States,9/14/2018,2018,TV-MA,98 min,"Comedies, Dramas, Independent Movies",98
s4647,Movie,On My Skin,Alessio Cremonini,Italy,9/12/2018,2018,TV-MA,100 min,"Dramas, International Movies",100
s4650,Movie,The Resistance Banker,Joram Lürsen,Netherlands,9/11/2018,2018,TV-MA,123 min,"Dramas, International Movies",123
s4657,Movie,Next Gen,"Kevin R. Adams, Joe Ksander",China,9/7/2018,2018,TV-PG,106 min,"Children & Family Movies, Comedies, Sci-Fi & Fantasy",106
s4658,Movie,Sierra Burgess Is A Loser,Ian Samuels,United States,9/7/2018,2018,PG-13,106 min,"Comedies, Romantic Movies",106
s4660,Movie,The Most Assassinated Woman in the World,Franck Ribière,Belgium,9/7/2018,2018,TV-MA,102 min,"Dramas, International Movies, Thrillers",102
s4661,Movie,PK,Rajkumar Hirani,India,9/6/2018,2014,TV-14,146 min,"Comedies, Dramas, International Movies",146
s4662,Movie,The Debt Collector,Jesse V. Johnson,United Kingdom,9/3/2018,2018,TV-MA,96 min,Action & Adventure,96
s4666,Movie,Carbon,Olivier Marchal,France,9/1/2018,2017,TV-MA,104 min,"Dramas, International Movies, Thrillers",104
s4667,Movie,Garbage,Qaushiq Mukherjee,India,9/1/2018,2018,TV-MA,109 min,"Dramas, Independent Movies, International Movies",109
s4668,Movie,​​Kuch Bheege Alfaaz,Onir,India,9/1/2018,2018,TV-14,110 min,"Dramas, Independent Movies, International Movies",110
s4669,Movie,Love and Shukla,Jatla Siddartha,India,9/1/2018,2017,TV-MA,110 min,"Dramas, Independent Movies, International Movies",110
s4670,Movie,Once Again,Kanwal Sethi,India,9/1/2018,2018,TV-PG,101 min,"Dramas, Independent Movies, International Movies",101
s4672,Movie,Sparring,Samuel Jouy,France,9/1/2018,2017,TV-MA,94 min,"Dramas, International Movies, Sports Movies",94
s4685,Movie,Bert Kreischer: Secret Time,Todd Biermann,Not Given,8/24/2018,2018,TV-MA,57 min,Stand-Up Comedy,57
s4676,Movie,The Laws of Thermodynamics,Mateo Gil,Spain,8/31/2018,2018,TV-MA,101 min,"Comedies, International Movies, Romantic Movies",101
s4680,Movie,Naam Shabana,Shivam Nair,India,8/28/2018,2017,TV-14,141 min,"Action & Adventure, International Movies",141
s4681,Movie,Qarib Qarib Singlle,Tanuja Chandra,India,8/28/2018,2017,TV-14,120 min,"Comedies, International Movies, Romantic Movies",120
s4682,Movie,Spyder,A.R. Murugadoss,India,8/28/2018,2017,TV-14,140 min,"Action & Adventure, International Movies",140
s4684,Movie,Maria Bamford: The Special Special Special,Jordan Brady,United States,8/25/2018,2012,TV-MA,50 min,Stand-Up Comedy,50
s4687,Movie,One Last Shot,Mike Clattenburg,Canada,8/24/2018,1998,TV-MA,31 min,Comedies,31
s4689,Movie,The After Party,Ian Edelman,United States,8/24/2018,2018,TV-MA,90 min,"Comedies, Music & Musicals",90
s4691,Movie,Bareilly Ki Barfi,Ashwiny Iyer Tiwari,India,8/21/2018,2017,TV-14,110 min,"Comedies, Dramas, International Movies",110
s4692,Movie,Mersal,Atlee Kumar,India,8/21/2018,2017,TV-14,162 min,"Action & Adventure, Dramas, International Movies",162
s4693,Movie,Mom,Ravi Udyawar,India,8/21/2018,2017,TV-14,139 min,"Dramas, International Movies, Thrillers",139
s4694,Movie,Pad Man,R. Balki,India,8/21/2018,2018,PG-13,130 min,"Dramas, International Movies, Romantic Movies",130
s4695,Movie,Toilet: Ek Prem Katha,Shree Narayan Singh,India,8/21/2018,2017,TV-14,145 min,"Comedies, Dramas, International Movies",145
s4698,Movie,The Motive,Manuel Martín Cuenca,Spain,8/17/2018,2017,TV-MA,114 min,"Comedies, Dramas, International Movies",114
s4699,Movie,To All the Boys I’ve Loved Before,Susan Johnson,United States,8/17/2018,2018,TV-14,100 min,"Comedies, International Movies, Romantic Movies",100
s4700,Movie,Yoo Byung Jae: Discomfort Zone,Y. Joon Chung,South Korea,8/17/2018,2018,TV-MA,54 min,Stand-Up Comedy,54
s4701,Movie,Bhavesh Joshi Superhero,Vikramaditya Motwane,India,8/16/2018,2018,TV-14,150 min,"Dramas, International Movies, Sci-Fi & Fantasy",150
s4702,Movie,For Here or to Go?,Rucha Humnabadkar,United States,8/15/2018,2015,TV-MA,105 min,"Comedies, Dramas, Independent Movies",105
s4706,Movie,The Guernsey Literary and Potato Peel Pie Society,Mike Newell,United Kingdom,8/10/2018,2018,TV-PG,124 min,"Dramas, Romantic Movies",124
s4707,Movie,The Package,Jake Szymanski,United States,8/10/2018,2018,TV-MA,95 min,Comedies,95
s4708,Movie,Zion,Floyd Russ,United States,8/10/2018,2018,TV-PG,12 min,"Documentaries, Sports Movies",12
s4709,Movie,Perdida,Alejandro Montiel,Argentina,8/9/2018,2018,TV-MA,104 min,"Dramas, International Movies, Thrillers",104
s4713,Movie,2 States,Abhishek Varman,India,8/4/2018,2014,TV-PG,143 min,"Comedies, Dramas, International Movies",143
s4714,Movie,Baaghi,Sabir Khan,India,8/4/2018,2016,TV-14,127 min,"Action & Adventure, International Movies",127
s4715,Movie,Brij Mohan Amar Rahe,Nikhil Nagesh Bhat,India,8/4/2018,2018,TV-MA,100 min,"Comedies, Dramas, International Movies",100
s4716,Movie,Flavors of Youth: International Version,"Xiaoxing Yi, Yoshitaka Takeuchi, Haoling Li",China,8/4/2018,2018,TV-PG,74 min,"Anime Features, International Movies, Romantic Movies",74
s4719,Movie,Like Father,Lauren Miller Rogen,United States,8/3/2018,2018,TV-MA,104 min,"Comedies, Dramas",104
s4720,Movie,7 Khoon Maaf,Vishal Bhardwaj,India,8/2/2018,2011,TV-MA,148 min,"Dramas, International Movies, Thrillers",148
s4721,Movie,Chillar Party,"Vikas Bahl, Nitesh Tiwari",India,8/2/2018,2011,TV-PG,127 min,"Children & Family Movies, Comedies, Dramas",127
s4722,Movie,Fashion,Madhur Bhandarkar,India,8/2/2018,2008,TV-MA,158 min,"Dramas, International Movies",158
s4723,Movie,Fitoor,Abhishek Kapoor,India,8/2/2018,2016,TV-14,124 min,"Dramas, International Movies, Romantic Movies",124
s4724,Movie,Fiza,Khalid Mohamed,India,8/2/2018,2000,TV-14,163 min,"Dramas, International Movies, Music & Musicals",163
s4725,Movie,Guzaarish,Sanjay Leela Bhansali,India,8/2/2018,2010,TV-14,121 min,"Dramas, International Movies",121
s4726,Movie,Haider,Vishal Bhardwaj,India,8/2/2018,2014,TV-MA,154 min,"Dramas, International Movies, Romantic Movies",154
s4727,Movie,Highway,Imtiaz Ali,India,8/2/2018,2014,TV-14,127 min,"Action & Adventure, Dramas, International Movies",127
s4728,Movie,I Hate Luv Storys,Punit Malhotra,India,8/2/2018,2010,TV-14,128 min,"Comedies, International Movies, Music & Musicals",128
s4729,Movie,Joker,Shirish Kunder,India,8/2/2018,2012,TV-PG,98 min,"Comedies, International Movies, Music & Musicals",98
s4730,Movie,Main aurr Mrs. Khanna,Prem Soni,India,8/2/2018,2009,TV-14,109 min,"International Movies, Music & Musicals, Romantic Movies",109
s4731,Movie,Mohenjo Daro,Ashutosh Gowariker,India,8/2/2018,2016,TV-14,168 min,"Action & Adventure, Dramas, International Movies",168
s4732,Movie,Raajneeti,Prakash Jha,India,8/2/2018,2010,TV-14,162 min,"Dramas, International Movies, Thrillers",162
s5002,Movie,Malena Pichot: Estupidez compleja,"Raúl Campos, Jan Suter",Argentina,3/2/2018,2018,TV-MA,51 min,Stand-Up Comedy,51
s4733,Movie,Rang De Basanti,Rakeysh Omprakash Mehra,India,8/2/2018,2006,TV-14,159 min,"Dramas, International Movies",159
s4734,Movie,Rowdy Rathore,Prabhu Deva,India,8/2/2018,2012,TV-14,137 min,"Action & Adventure, Comedies, International Movies",137
s4735,Movie,Tamasha,Imtiaz Ali,India,8/2/2018,2015,TV-14,133 min,"Dramas, International Movies, Romantic Movies",133
s4736,Movie,Tere Naal Love Ho Gaya,Mandeep Kumar,India,8/2/2018,2012,TV-14,127 min,"Comedies, International Movies, Romantic Movies",127
s4737,Movie,Thank You,Anees Bazmee,India,8/2/2018,2011,TV-14,131 min,"Comedies, International Movies, Romantic Movies",131
s4738,Movie,The Blue Umbrella,Vishal Bhardwaj,India,8/2/2018,2005,TV-PG,90 min,"Children & Family Movies, Dramas, Independent Movies",90
s4740,Movie,Being Napoleon,"Jesse Handsher, Olivier Roland",United States,8/1/2018,2018,TV-MA,88 min,Documentaries,88
s4741,Movie,Invisible,Pablo Giorgelli,Argentina,8/1/2018,2017,TV-MA,87 min,"Dramas, Independent Movies, International Movies",87
s4746,Movie,Da Kath & Kim Code,Ted Emery,Australia,7/28/2018,2005,TV-PG,82 min,Movies,82
s4747,Movie,Kath & Kimderella,Ted Emery,Australia,7/28/2018,2012,TV-14,86 min,Comedies,86
s4749,Movie,The Mansion,Tony Datis,France,7/28/2018,2017,TV-MA,100 min,"Comedies, Horror Movies, International Movies",100
s4750,Movie,Coco y Raulito: Carrusel de ternura,"Raúl Campos, Jan Suter",Mexico,7/27/2018,2018,TV-MA,57 min,Stand-Up Comedy,57
s4752,Movie,Extinction,Ben Young,United States,7/27/2018,2018,TV-MA,95 min,"Action & Adventure, Dramas, Sci-Fi & Fantasy",95
s4754,Movie,The Bleeding Edge,Kirby Dick,Australia,7/27/2018,2018,TV-14,101 min,Documentaries,101
s4756,Movie,Parmanu: The Story of Pokhran,Abhishek Sharma,India,7/25/2018,2018,TV-PG,124 min,"Dramas, International Movies",124
s4757,Movie,Iliza Shlesinger: Elder Millennial,Steve Paley,United States,7/24/2018,2018,TV-MA,72 min,Stand-Up Comedy,72
s4758,Movie,The Warning,Daniel Calparsoro,Spain,7/24/2018,2018,TV-MA,93 min,"International Movies, Thrillers",93
s4761,Movie,Duck Duck Goose,Chris Jenkins,China,7/20/2018,2018,PG,92 min,"Children & Family Movies, Comedies",92
s4766,Movie,Nothing to Lose,Alexandre Avancini,Brazil,7/20/2018,2018,PG,133 min,"Dramas, Faith & Spirituality, International Movies",133
s4769,Movie,Camarón: The Film,Alexis Morante,Spain,7/18/2018,2018,TV-14,105 min,"Documentaries, International Movies, Music & Musicals",105
s4770,Movie,GODZILLA City on the Edge of Battle,"Kobun Shizuno, Hiroyuki Seshita",Japan,7/18/2018,2018,TV-14,101 min,"Action & Adventure, Anime Features, International Movies",101
s4771,Movie,Going for Gold,Clay Glen,Australia,7/15/2018,2018,TV-G,88 min,"Children & Family Movies, Dramas, International Movies",88
s4774,Movie,How It Ends,David M. Rosenthal,United States,7/13/2018,2018,TV-MA,113 min,"Action & Adventure, Sci-Fi & Fantasy",113
s4775,Movie,Jim Jefferies: This Is Me Now,Scott Zabielski,United States,7/13/2018,2018,TV-MA,71 min,Stand-Up Comedy,71
s4776,Movie,Romina,Diego Cohen,Mexico,7/13/2018,2018,TV-MA,75 min,"Horror Movies, Independent Movies, International Movies",75
s4782,Movie,Luciano Mellera: Infantiloide,"Raúl Campos, Jan Suter",Argentina,7/6/2018,2018,TV-14,66 min,Stand-Up Comedy,66
s4783,Movie,The Legacy of a Whitetail Deer Hunter,Jody Hill,United States,7/6/2018,2018,TV-14,83 min,"Action & Adventure, Comedies, Dramas",83
s4784,Movie,The Skin of the Wolf,Samu Fuentes,Spain,7/6/2018,2018,TV-MA,110 min,"Dramas, Independent Movies, International Movies",110
s4785,Movie,White Fang,Alexandre Espigares,France,7/6/2018,2018,TV-PG,88 min,"Children & Family Movies, Dramas",88
s4786,Movie,Sommore: Chandelier Status,Kevin Layne,United States,7/4/2018,2013,TV-MA,77 min,Stand-Up Comedy,77
s4787,Movie,Felipe Esparza: They're Not Going to Laugh at You,Scott L. Montoya,United States,7/3/2018,2012,TV-MA,58 min,Stand-Up Comedy,58
s4788,Movie,Joan Rivers: Don't Start with Me,Scott L. Montoya,United States,7/3/2018,2012,TV-MA,69 min,Stand-Up Comedy,69
s4789,Movie,Katt Williams: Kattpacalypse,Marcus Raboy,United States,7/3/2018,2012,TV-MA,61 min,Stand-Up Comedy,61
s4790,Movie,King of Peking,Sam Voutas,China,7/2/2018,2018,TV-14,88 min,"Comedies, Dramas, International Movies",88
s4791,Movie,Anthony Kaun Hai?,Raj Kaushal,India,7/1/2018,2006,TV-14,122 min,"Comedies, Dramas, International Movies",122
s4792,Movie,Bo Burnham: what.,"Bo Burnham, Christopher Storer",United States,7/1/2018,2013,TV-MA,60 min,Stand-Up Comedy,60
s4793,Movie,Chalte Chalte,Aziz Mirza,India,7/1/2018,2003,TV-14,166 min,"Dramas, International Movies, Romantic Movies",166
s4794,Movie,Deewana Main Deewana,K.C. Bokadia,India,7/1/2018,2013,TV-14,107 min,"Comedies, Dramas, International Movies",107
s4795,Movie,Duck Butter,Miguel Arteta,United States,7/1/2018,2018,TV-MA,94 min,"Dramas, Independent Movies, LGBTQ Movies",94
s4796,Movie,I Am Kalam,Nila Madhab Panda,India,7/1/2018,2010,TV-PG,87 min,"Children & Family Movies, Comedies, Dramas",87
s4797,Movie,My Birthday Song,Samir Soni,India,7/1/2018,2018,TV-14,92 min,"Dramas, International Movies, Thrillers",92
s4798,Movie,Namastey London,Vipul Amrutlal Shah,India,7/1/2018,2007,TV-14,130 min,"Comedies, Dramas, International Movies",130
s4800,Movie,Soul Robbers,Juan Antonio de la Riva,Mexico,7/1/2018,2015,TV-14,88 min,"Horror Movies, International Movies",88
s4801,Movie,Tum Milo Toh Sahi,Kabir Sadanand,India,7/1/2018,2010,TV-14,128 min,"Comedies, Dramas, International Movies",128
s4802,Movie,What We Started,"Bert Marcus, Cyrus Saidi",United States,7/1/2018,2017,TV-MA,96 min,"Documentaries, Music & Musicals",96
s4803,Movie,Zoo,Shlok Sharma,India,7/1/2018,2018,TV-MA,94 min,"Dramas, Independent Movies, International Movies",94
s4804,Movie,Bill Burr: You People Are All the Same,Jay Karas,United States,6/30/2018,2012,TV-MA,69 min,Stand-Up Comedy,69
s4806,Movie,The Maus,Yayo Herrero,Spain,6/30/2018,2017,TV-MA,90 min,"Horror Movies, Independent Movies, International Movies",90
s4807,Movie,Calibre,Matt Palmer,United Kingdom,6/29/2018,2018,TV-MA,101 min,"Dramas, International Movies, Thrillers",101
s4809,Movie,Jani Dueñas: Grandes fracasos de ayer y hoy,"Raúl Campos, Jan Suter",Chile,6/29/2018,2018,TV-MA,77 min,Stand-Up Comedy,77
s4811,Movie,Penalty Kick,Rodrigo Triana,Colombia,6/29/2018,2018,TV-14,89 min,"Comedies, Dramas, International Movies",89
s4812,Movie,Recovery Boys,Elaine McMillion Sheldon,United States,6/29/2018,2018,TV-MA,90 min,Documentaries,90
s4813,Movie,TAU,Federico D'Alessandro,United States,6/29/2018,2018,R,98 min,"Sci-Fi & Fantasy, Thrillers",98
s4815,Movie,W. Kamau Bell: Private School Negro,Shannon Hartman,United States,6/26/2018,2018,TV-MA,66 min,Stand-Up Comedy,66
s4817,Movie,Expelled from Paradise,Seiji Mizushima,Japan,6/25/2018,2014,TV-MA,103 min,"Action & Adventure, Anime Features, Sci-Fi & Fantasy",103
s4818,Movie,"To Each, Her Own",Myriam Aziza,France,6/24/2018,2018,TV-MA,95 min,"Comedies, International Movies, LGBTQ Movies",95
s4820,Movie,Brain on Fire,Gerard Barrett,United States,6/22/2018,2016,PG-13,89 min,"Dramas, Independent Movies, International Movies",89
s4823,Movie,Us and Them,Rene Liu,China,6/22/2018,2018,TV-MA,119 min,"Dramas, International Movies, Romantic Movies",119
s4824,Movie,Hannah Gadsby: Nanette,"Madeleine Parry, Jon Olb",Australia,6/19/2018,2018,TV-MA,70 min,Stand-Up Comedy,70
s4826,Movie,Lust Stories,"Zoya Akhtar, Karan Johar, Anurag Kashyap, Dibakar Banerjee",India,6/15/2018,2018,TV-MA,121 min,"Comedies, Dramas, International Movies",121
s4827,Movie,Maktub,Oded Raz,Israel,6/15/2018,2018,TV-MA,106 min,"Comedies, International Movies",106
s4828,Movie,Pacificum: Return to the Ocean,"Mariana Tschudi, Héctor Gálvez",Peru,6/15/2018,2017,TV-G,74 min,"Documentaries, International Movies",74
s4829,Movie,Set It Up,Claire Scanlon,United States,6/15/2018,2018,TV-MA,106 min,"Comedies, Romantic Movies",106
s4830,Movie,Sunday's Illness,Ramón Salazar,Spain,6/15/2018,2017,PG-13,113 min,"Dramas, Independent Movies, International Movies",113
s4831,Movie,The last hour,Eduardo Mendoza de Echave,Chile,6/15/2018,2017,TV-MA,119 min,"Dramas, International Movies",119
s4834,Movie,Alex Strangelove,Craig Johnson,United States,6/8/2018,2018,TV-MA,100 min,"Comedies, Dramas, Independent Movies",100
s4835,Movie,Ali's Wedding,Jeffrey Walker,Australia,6/8/2018,2018,TV-MA,110 min,"Comedies, Independent Movies, International Movies",110
s4836,Movie,Franco Escamilla: Por la anécdota,Ulises Valencia,Mexico,6/8/2018,2018,TV-MA,66 min,Stand-Up Comedy,66
s4821,Movie,Derren Brown: Miracle,Not Given,United Kingdom,6/22/2018,2018,TV-MA,74 min,International Movies,74
s4840,Movie,B.A. Pass 2,Shadab Khan,India,6/1/2018,2017,TV-14,126 min,"Dramas, International Movies",126
s4841,Movie,Bad Genius,Nattawut Poonpiriya,Thailand,6/1/2018,2017,TV-MA,130 min,"Dramas, International Movies, Thrillers",130
s4843,Movie,Outside In,Lynn Shelton,United States,6/1/2018,2018,TV-MA,110 min,"Dramas, Independent Movies",110
s4844,Movie,Pedal the World,Felix Starck,Germany,6/1/2018,2015,TV-MA,85 min,"Documentaries, International Movies, Sports Movies",85
s4848,Movie,Sara's Notebook,Norberto López Amado,Spain,5/26/2018,2018,TV-MA,117 min,"Dramas, International Movies, Thrillers",117
s4850,Movie,Fernando Sanjiao: Hombre,"Raúl Campos, Jan Suter",Argentina,5/25/2018,2018,TV-MA,63 min,Stand-Up Comedy,63
s4851,Movie,Ibiza,Alex Richanbach,United States,5/25/2018,2018,TV-MA,94 min,"Comedies, Romantic Movies",94
s4852,Movie,Steve Martin and Martin Short: An Evening You Will Forget for the Rest of Your Life,Marcus Raboy,United States,5/25/2018,2018,TV-14,74 min,Stand-Up Comedy,74
s4855,Movie,Tig Notaro Happy To Be Here,Tig Notaro,United States,5/22/2018,2018,TV-14,58 min,Stand-Up Comedy,58
s4856,Movie,Catching Feelings,Kagiso Lediga,South Africa,5/18/2018,2018,TV-MA,117 min,"Comedies, International Movies, Romantic Movies",117
s4859,Movie,Katt Williams: American Hustle (The Movie),Brit McAdams,United States,5/17/2018,2007,TV-MA,89 min,Stand-Up Comedy,89
s4860,Movie,Food on the Go,Mercedes Cordova,Argentina,5/16/2018,2017,TV-MA,66 min,"Documentaries, International Movies",66
s4861,Movie,Aiyaary,Neeraj Pandey,India,5/15/2018,2018,TV-MA,158 min,"Action & Adventure, Dramas, International Movies",158
s4862,Movie,Lupin the 3rd: The Castle of Cagliostro: Special Edition,Hayao Miyazaki,Japan,5/15/2018,1979,PG-13,100 min,"Action & Adventure, Anime Features, Classic Movies",100
s4864,Movie,Ali Wong: Hard Knock Wife,Jay Karas,United States,5/13/2018,2018,TV-MA,64 min,Stand-Up Comedy,64
s4865,Movie,Spivak,"Anthony Abrams, Adam Larson Broder",United States,5/12/2018,2017,TV-MA,92 min,"Comedies, Independent Movies",92
s4867,Movie,Carlos Ballarta: Furia Ñera,"Raúl Campos, Jan Suter",Mexico,5/11/2018,2018,TV-MA,63 min,Stand-Up Comedy,63
s4869,Movie,The Kissing Booth,Vince Marcello,United Kingdom,5/11/2018,2018,TV-14,105 min,"Comedies, Romantic Movies",105
s4871,Movie,Hari Kondabolu: Warn Your Relatives,Bobcat Goldthwait,United States,5/8/2018,2018,TV-MA,67 min,Stand-Up Comedy,67
s4872,Movie,My Fuhrer,Dani Levy,Germany,5/7/2018,2007,TV-14,91 min,"Comedies, International Movies",91
s4873,Movie,Family Blood,Sonny Mallhi,United States,5/5/2018,2018,TV-MA,92 min,Horror Movies,92
s4874,Movie,Pup Star: World Tour,Robert Vince,Canada,5/5/2018,2018,G,87 min,"Children & Family Movies, Comedies, Music & Musicals",87
s4876,Movie,Anon,Andrew Niccol,United Kingdom,5/4/2018,2018,TV-MA,100 min,"Dramas, Sci-Fi & Fantasy, Thrillers",100
s4877,Movie,Dany Boon: Des Hauts De France,Isabelle Nanty,France,5/4/2018,2018,TV-MA,113 min,Stand-Up Comedy,113
s4878,Movie,End Game,"Rob Epstein, Jeffrey Friedman",United States,5/4/2018,2018,TV-PG,40 min,Documentaries,40
s4879,Movie,Forgive Us Our Debts,Antonio Morabito,Italy,5/4/2018,2018,TV-MA,105 min,"Dramas, International Movies",105
s4898,Movie,Pocoyo Special Sports,"Guillermo Garcia, David Cantolla",Not Given,5/1/2018,2016,TV-Y,24 min,Movies,24
s4881,Movie,Lo más sencillo es complicarlo todo,Rene Bueno,Mexico,5/4/2018,2018,TV-14,94 min,"Comedies, International Movies, Romantic Movies",94
s4882,Movie,Manhunt,John Woo,China,5/4/2018,2017,TV-MA,109 min,"Action & Adventure, International Movies",109
s4883,Movie,Thi Mai,Patricia Ferreira,Spain,5/4/2018,2017,TV-MA,99 min,"Comedies, Dramas, International Movies",99
s4884,Movie,Si saben cómo me pongo ¿pá qué me invitan?,Fernando Ayllón,Colombia,5/3/2018,2018,TV-MA,89 min,"Comedies, International Movies",89
s4885,Movie,Jailbreak,Jimmy Henderson,Cambodia,5/2/2018,2017,TV-MA,92 min,"Action & Adventure, International Movies",92
s4886,Movie,Ajji,Devashish Makhija,India,5/1/2018,2017,TV-MA,105 min,"Dramas, International Movies",105
s4887,Movie,CIA: Comrade in America,Amal Neerad,India,5/1/2018,2017,TV-14,130 min,"Action & Adventure, Dramas, Independent Movies",130
s4888,Movie,Coffee for All,"Fluvio Iannuci, Roly Santos",Italy,5/1/2018,2017,TV-PG,69 min,"Documentaries, International Movies",69
s4889,Movie,Darc,Julius R. Nasso,United States,5/1/2018,2018,TV-MA,98 min,"Action & Adventure, Independent Movies",98
s4890,Movie,Despido Procedente,Lucas Figueroa,Argentina,5/1/2018,2017,TV-MA,90 min,"Comedies, International Movies",90
s4891,Movie,John Mulaney: Kid Gorgeous at Radio City,Alex Timbers,United States,5/1/2018,2018,TV-MA,65 min,Stand-Up Comedy,65
s4892,Movie,My Perfect Romance,Justin G. Dyck,Canada,5/1/2018,2018,PG,92 min,"Comedies, International Movies, Romantic Movies",92
s4894,Movie,Pocoyo & The Space Circus,Alfonso Rodríguez,Spain,5/1/2018,2008,TV-Y,25 min,Movies,25
s4900,Movie,Sometimes,Priyadarshan,India,5/1/2018,2016,TV-14,101 min,"Dramas, International Movies",101
s4902,Movie,The Clapper,Dito Montiel,United States,5/1/2018,2017,R,90 min,"Comedies, Dramas, Independent Movies",90
s4903,Movie,Toc Toc,Vicente Villanueva,Spain,5/1/2018,2017,TV-MA,96 min,"Comedies, International Movies",96
s4905,Movie,Running Shaadi,Amit Roy,India,4/30/2018,2017,TV-14,115 min,"Comedies, International Movies, Romantic Movies",115
s4906,Movie,The Price of Success,Teddy Lussi-Modeste,France,4/30/2018,2017,TV-MA,92 min,"Dramas, International Movies",92
s4908,Movie,Candy Jar,Ben Shelton,United States,4/27/2018,2018,TV-14,93 min,"Children & Family Movies, Dramas, Romantic Movies",93
s4910,Movie,Holy Goalie,Curro Velázquez,Spain,4/27/2018,2017,TV-MA,95 min,"Comedies, International Movies, Sports Movies",95
s4912,Movie,The Rachel Divide,Laura Brownson,United States,4/27/2018,2018,TV-MA,105 min,Documentaries,105
s4913,Movie,The Week Of,Robert Smigel,United States,4/27/2018,2018,TV-14,117 min,Comedies,117
s4916,Movie,Enissa Amani: Ehrenwort,Max Amini,Germany,4/26/2018,2018,TV-MA,66 min,Stand-Up Comedy,66
s4917,Movie,Bill Nye: Science Guy,"Jason Sussberg, David Alvarado",United States,4/25/2018,2017,TV-PG,97 min,Documentaries,97
s4918,Movie,Fishtronaut: The Movie,"Célia Catunda, Kiko Mistrorigo, Rodrigo Eba",Brazil,4/25/2018,2018,TV-Y,78 min,Children & Family Movies,78
s4919,Movie,Psychokinesis,Sang-ho Yeon,South Korea,4/25/2018,2018,TV-MA,102 min,"Action & Adventure, Comedies, International Movies",102
s4920,Movie,Kevin James: Never Don't Give Up,Andy Fickman,United States,4/24/2018,2018,TV-PG,62 min,Stand-Up Comedy,62
s4921,Movie,Dude,Olivia Milch,United States,4/20/2018,2018,TV-MA,97 min,"Comedies, Dramas, Independent Movies",97
s4922,Movie,Kodachrome,Mark Raso,Canada,4/20/2018,2018,TV-MA,105 min,"Comedies, Dramas",105
s4923,Movie,Mercury 13,"David Sington, Heather Walsh",United States,4/20/2018,2018,TV-PG,79 min,Documentaries,79
s4924,Movie,All The Reasons To Forget,Pedro Coutinho,Brazil,4/19/2018,2017,TV-MA,90 min,"Comedies, Dramas, International Movies",90
s4928,Movie,Beyond Skyline,Liam O'Donnell,United States,4/15/2018,2017,R,107 min,"Action & Adventure, Sci-Fi & Fantasy",107
s4929,Movie,Come Sunday,Joshua Marston,United States,4/13/2018,2018,TV-14,105 min,"Dramas, Faith & Spirituality, Independent Movies",105
s4930,Movie,I Am not an Easy Man,Eleonore Pourriat,France,4/13/2018,2018,TV-MA,99 min,"Comedies, International Movies, Romantic Movies",99
s4932,Movie,Pickpockets,Peter Webber,Colombia,4/12/2018,2017,TV-MA,108 min,"Dramas, Independent Movies, International Movies",108
s4933,Movie,Greg Davies: You Magnificent Beast,Peter Orton,United Kingdom,4/10/2018,2018,TV-MA,66 min,Stand-Up Comedy,66
s4935,Movie,6 Balloons,Marja Lewis Ryan,United States,4/6/2018,2018,TV-MA,75 min,"Dramas, Independent Movies",75
s4936,Movie,Amateur,Ryan Koo,United States,4/6/2018,2018,TV-MA,96 min,"Dramas, Independent Movies, Sports Movies",96
s4937,Movie,Orbiter 9,Hatem Khraiche,Spain,4/6/2018,2017,TV-14,95 min,"Dramas, International Movies, Sci-Fi & Fantasy",95
s4938,Movie,"Ram Dass, Going Home",Derek Peck,United States,4/6/2018,2018,TV-14,32 min,"Documentaries, Faith & Spirituality",32
s4939,Movie,Seth Rogen's Hilarity for Charity,Ryan Polito,United States,4/6/2018,2018,TV-MA,70 min,Stand-Up Comedy,70
s4940,Movie,Sun Dogs,Jennifer Morrison,Mexico,4/6/2018,2017,TV-MA,94 min,"Comedies, Dramas, Independent Movies",94
s4941,Movie,Todo lo que sería Lucas Lauriente,"Raúl Campos, Jan Suter",Argentina,4/6/2018,2018,TV-MA,78 min,Stand-Up Comedy,78
s4944,Movie,Day of the Dead: Bloodline,Hèctor Hernández Vicens,Bulgaria,4/5/2018,2018,R,91 min,"Horror Movies, Independent Movies",91
s4945,Movie,Fary Is the New Black,Kader Aoun,France,4/3/2018,2018,TV-MA,75 min,Stand-Up Comedy,75
s4946,Movie,Ittefaq,Abhay Chopra,India,4/3/2018,2017,TV-MA,105 min,"Dramas, International Movies, Thrillers",105
s4948,Movie,A Sort of Family,Diego Lerman,Argentina,4/1/2018,2017,TV-14,96 min,"Dramas, International Movies, Thrillers",96
s4949,Movie,Billu,Priyadarshan,India,4/1/2018,2009,TV-PG,132 min,"Dramas, International Movies",132
s4951,Movie,John Mulaney: New in Town,Ryan Polito,United States,4/1/2018,2012,TV-MA,60 min,Stand-Up Comedy,60
s4953,Movie,Main Hoon Na,Farah Khan,India,4/1/2018,2004,TV-14,171 min,"Action & Adventure, Comedies, Dramas",171
s4954,Movie,Metro,Ananda Krishnan,India,4/1/2018,2016,TV-14,116 min,"Dramas, International Movies, Thrillers",116
s4955,Movie,Om Shanti Om,Farah Khan,India,4/1/2018,2007,TV-14,169 min,"Comedies, Dramas, International Movies",169
s4956,Movie,Paheli,Amol Palekar,India,4/1/2018,2005,TV-PG,134 min,"Dramas, International Movies, Romantic Movies",134
s4957,Movie,Phir Bhi Dil Hai Hindustani,Aziz Mirza,India,4/1/2018,2000,TV-14,159 min,"Comedies, Dramas, International Movies",159
s4959,Movie,Revolt,Joe Miale,United Kingdom,3/31/2018,2017,R,87 min,"Action & Adventure, Sci-Fi & Fantasy",87
